donor_id,name_of_org,contact,email,address,coordinates
1,Sri Sathya Sai Vidya Vihar,9826358380,sai@sathyasaiindore.com,"Sri Sathya Sai Vidhya Vihar, Old A. B. Road, Indore City, Indore, Juni Indore Tahsil, Indore, Madhya Pradesh, 452001, India","(22.757286154164834, 75.90080800995301)"
2,TEST NAME 1,1234567890,mukundgupta2121@gmail.com,"BCM Heights, indore, india","(22.754022893354374,75.90081762245143)"
3,TESTNAME,,W,"Khajrana Square, indore, india","('22.7319962', '75.9023972')"
4,NAME,,mukundgupta2121@gmail.com,"Khajrana Square, indore, india","('22.7319962', '75.9023972')"
5,ATIKSH,,ERG,mangalmurti krishnaji nagar,manual intervention required!
6,vrdesdb,,rfesdf,rsd,"('41.0749752', '-7.950630855848868')"
